{
  "eventId": "11111111-1111-4111-8111-111111111111",
  "jobId": "11111111-1111-4111-8111-111111111111",
  "attemptId": "11111111-1111-4111-8111-111111111111",
  "correlationId": "11111111-1111-4111-8111-111111111111",
  "outputManifestId": "11111111-1111-4111-8111-111111111111",
  "schemaVersion": 1,
  "leaseToken": 1,
  "sequence": 2,
  "kind": "succeeded",
  "stage": "PREVIEW",
  "occurredAt": "2026-09-16T12:10:00Z"
}
